{
  "candidate_set_id": "PUR_NEW_STAGE1_BLIND_CANDIDATE_SPACE_V1",
  "candidates": [
    {
      "candidate_id": "S1C01",
      "constraint_notes": [
        "Reactive-core-only formulation matching measured local design point E1 (PPG2000/PDP70 = 50/50, NCO:OH = 1.70), renormalized to total wt%.",
        "Admissible because it stays entirely inside the measured local chemistry; it tests reactive-core / stoichiometry tuning rather than resin modification.",
        "Search dimension introduced by the original local E1-E5 experimental design.",
        "No post-result information was used to construct this candidate."
      ],
      "evidence_references": [
        "LOCAL_FORMULATIONS",
        "LOCAL_TEMPERATURE_SWEEPS",
        "LOCAL_HOLD"
      ],
      "formulation_state": {
        "AC1920": 0.0,
        "MDI": 19.2866666667,
        "PDP70": 40.3566666667,
        "PPG2000": 40.3566666667,
        "TK100": 0.0,
        "amount_basis": "normalized_total_wt_percent",
        "design_layer": "measured_reactive_core_only"
      },
      "process_state": {
        "hold_temperature_c": null,
        "hold_time_min": null,
        "mixing_history": null,
        "reaction_temperature_c": null,
        "reaction_time_min": null,
        "sample_age": null
      }
    },
    {
      "candidate_id": "S1C02",
      "constraint_notes": [
        "Reactive-core-only formulation matching measured local design point E2 (PPG2000/PDP70 = 50/50, NCO:OH = 1.80), renormalized to total wt%.",
        "Admissible because it stays entirely inside the measured local chemistry; it tests reactive-core / stoichiometry tuning rather than resin modification.",
        "Search dimension introduced by the original local E1-E5 experimental design.",
        "No post-result information was used to construct this candidate."
      ],
      "evidence_references": [
        "LOCAL_FORMULATIONS",
        "LOCAL_TEMPERATURE_SWEEPS"
      ],
      "formulation_state": {
        "AC1920": 0.0,
        "MDI": 20.1906730224,
        "PDP70": 39.9046634888,
        "PPG2000": 39.9046634888,
        "TK100": 0.0,
        "amount_basis": "normalized_total_wt_percent",
        "design_layer": "measured_reactive_core_only"
      },
      "process_state": {
        "hold_temperature_c": null,
        "hold_time_min": null,
        "mixing_history": null,
        "reaction_temperature_c": null,
        "reaction_time_min": null,
        "sample_age": null
      }
    },
    {
      "candidate_id": "S1C03",
      "constraint_notes": [
        "Reactive-core-only formulation matching measured local design point E3 (PPG2000/PDP70 = 50/50, NCO:OH = 1.90), renormalized to total wt%.",
        "Admissible because it stays entirely inside the measured local chemistry; it tests reactive-core / stoichiometry tuning rather than resin modification.",
        "Search dimension introduced by the original local E1-E5 experimental design.",
        "No post-result information was used to construct this candidate."
      ],
      "evidence_references": [
        "LOCAL_FORMULATIONS",
        "LOCAL_TEMPERATURE_SWEEPS"
      ],
      "formulation_state": {
        "AC1920": 0.0,
        "MDI": 21.0759641345,
        "PDP70": 39.4620179327,
        "PPG2000": 39.4620179327,
        "TK100": 0.0,
        "amount_basis": "normalized_total_wt_percent",
        "design_layer": "measured_reactive_core_only"
      },
      "process_state": {
        "hold_temperature_c": null,
        "hold_time_min": null,
        "mixing_history": null,
        "reaction_temperature_c": null,
        "reaction_time_min": null,
        "sample_age": null
      }
    },
    {
      "candidate_id": "S1C04",
      "constraint_notes": [
        "Reactive-core-only formulation matching measured local design point E4 (PPG2000/PDP70 = 60/40, NCO:OH = 1.80), renormalized to total wt%.",
        "Admissible because it stays entirely inside the measured local chemistry; it tests reactive-core / stoichiometry tuning rather than resin modification.",
        "Search dimension introduced by the original local E1-E5 experimental design.",
        "No post-result information was used to construct this candidate."
      ],
      "evidence_references": [
        "LOCAL_FORMULATIONS",
        "LOCAL_TEMPERATURE_SWEEPS"
      ],
      "formulation_state": {
        "AC1920": 0.0,
        "MDI": 19.8333333333,
        "PDP70": 32.0666666667,
        "PPG2000": 48.1,
        "TK100": 0.0,
        "amount_basis": "normalized_total_wt_percent",
        "design_layer": "measured_reactive_core_only"
      },
      "process_state": {
        "hold_temperature_c": null,
        "hold_time_min": null,
        "mixing_history": null,
        "reaction_temperature_c": null,
        "reaction_time_min": null,
        "sample_age": null
      }
    },
    {
      "candidate_id": "S1C05",
      "constraint_notes": [
        "Reactive-core-only formulation matching measured local design point E5 (PPG2000/PDP70 = 40/60, NCO:OH = 1.80), renormalized to total wt%.",
        "Admissible because it stays entirely inside the measured local chemistry; it tests reactive-core / stoichiometry tuning rather than resin modification.",
        "Search dimension introduced by the original local E1-E5 experimental design.",
        "No post-result information was used to construct this candidate."
      ],
      "evidence_references": [
        "LOCAL_FORMULATIONS",
        "LOCAL_TEMPERATURE_SWEEPS",
        "LOCAL_HOLD"
      ],
      "formulation_state": {
        "AC1920": 0.0,
        "MDI": 20.5433333333,
        "PDP70": 47.6733333333,
        "PPG2000": 31.7833333333,
        "TK100": 0.0,
        "amount_basis": "normalized_total_wt_percent",
        "design_layer": "measured_reactive_core_only"
      },
      "process_state": {
        "hold_temperature_c": null,
        "hold_time_min": null,
        "mixing_history": null,
        "reaction_temperature_c": null,
        "reaction_time_min": null,
        "sample_age": null
      }
    },
    {
      "candidate_id": "S1C06",
      "constraint_notes": [
        "Reactive-core-only interpolation: stoichiometry midpoint between NCO:OH 1.70 and 1.80 at 50/50.",
        "Admissible because it lies strictly between two measured local design points, so it requires no extrapolation beyond the measured chemistry.",
        "Search dimension introduced by the original local E1-E5 design; this candidate exists so that continued reactive-core / stoichiometry tuning is a fully competitive alternative to resin modification.",
        "No post-result information was used to construct this candidate."
      ],
      "evidence_references": [
        "LOCAL_FORMULATIONS",
        "LOCAL_TEMPERATURE_SWEEPS"
      ],
      "formulation_state": {
        "AC1920": 0.0,
        "MDI": 19.7386698446,
        "PDP70": 40.1306650777,
        "PPG2000": 40.1306650777,
        "TK100": 0.0,
        "amount_basis": "normalized_total_wt_percent",
        "design_layer": "interpolated_reactive_core_only"
      },
      "process_state": {
        "hold_temperature_c": null,
        "hold_time_min": null,
        "mixing_history": null,
        "reaction_temperature_c": null,
        "reaction_time_min": null,
        "sample_age": null
      }
    },
    {
      "candidate_id": "S1C07",
      "constraint_notes": [
        "Reactive-core-only interpolation: stoichiometry midpoint between NCO:OH 1.80 and 1.90 at 50/50.",
        "Admissible because it lies strictly between two measured local design points, so it requires no extrapolation beyond the measured chemistry.",
        "Search dimension introduced by the original local E1-E5 design; this candidate exists so that continued reactive-core / stoichiometry tuning is a fully competitive alternative to resin modification.",
        "No post-result information was used to construct this candidate."
      ],
      "evidence_references": [
        "LOCAL_FORMULATIONS",
        "LOCAL_TEMPERATURE_SWEEPS"
      ],
      "formulation_state": {
        "AC1920": 0.0,
        "MDI": 20.6333185785,
        "PDP70": 39.6833407108,
        "PPG2000": 39.6833407108,
        "TK100": 0.0,
        "amount_basis": "normalized_total_wt_percent",
        "design_layer": "interpolated_reactive_core_only"
      },
      "process_state": {
        "hold_temperature_c": null,
        "hold_time_min": null,
        "mixing_history": null,
        "reaction_temperature_c": null,
        "reaction_time_min": null,
        "sample_age": null
      }
    },
    {
      "candidate_id": "S1C08",
      "constraint_notes": [
        "Reactive-core-only interpolation: polyol-ratio midpoint between 60/40 and 50/50 at NCO:OH 1.80.",
        "Admissible because it lies strictly between two measured local design points, so it requires no extrapolation beyond the measured chemistry.",
        "Search dimension introduced by the original local E1-E5 design; this candidate exists so that continued reactive-core / stoichiometry tuning is a fully competitive alternative to resin modification.",
        "No post-result information was used to construct this candidate."
      ],
      "evidence_references": [
        "LOCAL_FORMULATIONS",
        "LOCAL_TEMPERATURE_SWEEPS"
      ],
      "formulation_state": {
        "AC1920": 0.0,
        "MDI": 20.0120031779,
        "PDP70": 35.9856650777,
        "PPG2000": 44.0023317444,
        "TK100": 0.0,
        "amount_basis": "normalized_total_wt_percent",
        "design_layer": "interpolated_reactive_core_only"
      },
      "process_state": {
        "hold_temperature_c": null,
        "hold_time_min": null,
        "mixing_history": null,
        "reaction_temperature_c": null,
        "reaction_time_min": null,
        "sample_age": null
      }
    },
    {
      "candidate_id": "S1C09",
      "constraint_notes": [
        "Reactive-core-only interpolation: polyol-ratio midpoint between 50/50 and 40/60 at NCO:OH 1.80.",